{
 "record_id": "tiger-lab-mmlu-pro__en",
 "schema_version": "0.1.0",
 "dataset": {
  "id": "TIGER-Lab/MMLU-Pro",
  "hub": "huggingface",
  "url": "https://huggingface.co/datasets/TIGER-Lab/MMLU-Pro",
  "revision": "b189ec765aa7ed75c8acfea42df31fdae71f97be"
 },
 "root_benchmark": "MMLU-Pro",
 "target_languages": [
  "en"
 ],
 "source_language": "not_applicable",
 "derived_from": {
  "kind": "aggregation_of",
  "parent_id": "cais/mmlu",
  "parent_url": "https://huggingface.co/datasets/cais/mmlu"
 },
 "translation_type": "native_original",
 "engine_or_translator": "not_applicable",
 "human_verification": "not_applicable",
 "license": "mit",
 "claims": {
  "translation_type": {
   "status": "verified",
   "evidence": [
    "e1"
   ]
  },
  "engine_or_translator": {
   "status": "not_applicable",
   "evidence": []
  },
  "human_verification": {
   "status": "not_applicable",
   "evidence": []
  },
  "license": {
   "status": "verified",
   "evidence": [
    "e2"
   ]
  },
  "derived_from": {
   "status": "verified",
   "evidence": [
    "e1"
   ]
  },
  "source_language": {
   "status": "not_applicable",
   "evidence": []
  }
 },
 "evidence": [
  {
   "id": "e1",
   "type": "paper",
   "url": "https://arxiv.org/abs/2406.01574",
   "retrieved": "2026-08-24",
   "quote": "MMLU-Pro ... integrates more challenging, reasoning-focused questions and expands the choice set from four to ten options.",
   "note": "English items drawn from MMLU plus newly collected questions; no translation involved"
  },
  {
   "id": "e2",
   "type": "hub_metadata",
   "url": "https://huggingface.co/api/datasets/TIGER-Lab/MMLU-Pro",
   "retrieved": "2026-08-24",
   "hub_revision": "b189ec765aa7ed75c8acfea42df31fdae71f97be",
   "quote": "license: mit"
  }
 ],
 "completeness": 1.0,
 "provenance_state": "complete",
 "curated": {
  "date": "2026-08-24",
  "by": "benchprov v0 seed (A. H. Shihab)",
  "method": "assisted"
 },
 "notes": "Aggregates filtered MMLU items with newly collected English questions (TheoremQA, SciBench, STEM sources per paper)."
}
