{
 "record_id": "taresco-cohere-global-mmlu-filtered-math__multi",
 "schema_version": "0.1.0",
 "dataset": {
  "id": "taresco/COHERE-GLOBAL-MMLU-FILTERED-MATH",
  "hub": "huggingface",
  "url": "https://huggingface.co/datasets/taresco/COHERE-GLOBAL-MMLU-FILTERED-MATH",
  "revision": "fee6202e087810c7b9932222a15f7a01195ec512"
 },
 "root_benchmark": "MMLU",
 "target_languages": [
  "am",
  "ar",
  "ha",
  "ig",
  "sn",
  "sw",
  "so",
  "te"
 ],
 "source_language": "not_applicable",
 "derived_from": {
  "kind": "subset_or_filter_of",
  "parent_id": "CohereLabs/Global-MMLU",
  "parent_url": "https://huggingface.co/datasets/CohereLabs/Global-MMLU"
 },
 "translation_type": "mixed",
 "engine_or_translator": "unknown",
 "human_verification": "unknown",
 "license": "apache-2.0",
 "claims": {
  "translation_type": {
   "status": "name_only",
   "evidence": [
    "e1"
   ]
  },
  "engine_or_translator": {
   "status": "unknown",
   "evidence": [],
   "note": "no engine stated in this dataset's own sources; if the items derive from Global-MMLU as the name and column structure indicate, the machine-translated portion used Google Translate API per the parent's paper — see record coherelabs-global-mmlu__multi (recorded as unknown pending a direct statement; corrected 2026-08-24, see docs/PRE_RELEASE_AUDIT.md B1/M4)"
  },
  "human_verification": {
   "status": "unknown",
   "evidence": [],
   "note": "no verification statement in this dataset's own sources; the inherited is_annotated column marks the parent's cultural-bias-study annotations, not translation verification"
  },
  "license": {
   "status": "verified",
   "evidence": [
    "e2"
   ]
  },
  "derived_from": {
   "status": "name_only",
   "evidence": [
    "e1"
   ]
  },
  "source_language": {
   "status": "not_applicable",
   "evidence": [],
   "note": "not stated in this dataset's own sources; en if the Global-MMLU derivation holds"
  }
 },
 "evidence": [
  {
   "id": "e1",
   "type": "name_only",
   "url": "https://huggingface.co/datasets/taresco/COHERE-GLOBAL-MMLU-FILTERED-MATH",
   "retrieved": "2026-08-24",
   "note": "the Global-MMLU derivation is asserted by the dataset id ('COHERE-GLOBAL-MMLU-…') and corroborated by the card's YAML preserving Global-MMLU's per-item fields (see e2); the 'mixed' creation value applies to the items via that asserted derivation"
  },
  {
   "id": "e2",
   "type": "hub_metadata",
   "url": "https://huggingface.co/api/datasets/taresco/COHERE-GLOBAL-MMLU-FILTERED-MATH",
   "retrieved": "2026-08-24",
   "hub_revision": "fee6202e087810c7b9932222a15f7a01195ec512",
   "quote": "license: apache-2.0"
  }
 ],
 "completeness": 0.6,
 "provenance_state": "partial",
 "curated": {
  "date": "2026-08-24",
  "by": "benchprov v0 seed (A. H. Shihab)",
  "method": "assisted"
 },
 "notes": "Math-subject, African-language-focused filter of (per its name) Global-MMLU. Derivation and creation-method statuses rest on the dataset's naming plus preserved column structure — labeled name_only accordingly."
}
