{
 "record_id": "openai-mmmlu__multi",
 "schema_version": "0.1.0",
 "dataset": {
  "id": "openai/MMMLU",
  "hub": "huggingface",
  "url": "https://huggingface.co/datasets/openai/MMMLU",
  "revision": "325a01dc3e173cac1578df94120499aaca2e2504"
 },
 "root_benchmark": "MMLU",
 "target_languages": [
  "ar",
  "bn",
  "de",
  "es",
  "fr",
  "hi",
  "id",
  "it",
  "ja",
  "ko",
  "pt",
  "sw",
  "yo",
  "zh"
 ],
 "source_language": "en",
 "derived_from": {
  "kind": "translation_of",
  "parent_id": "cais/mmlu",
  "parent_url": "https://huggingface.co/datasets/cais/mmlu"
 },
 "translation_type": "human",
 "engine_or_translator": "professional human translators (unnamed vendor)",
 "human_verification": "unknown",
 "license": "mit",
 "claims": {
  "translation_type": {
   "status": "verified",
   "evidence": [
    "e1"
   ]
  },
  "engine_or_translator": {
   "status": "verified",
   "evidence": [
    "e1"
   ]
  },
  "human_verification": {
   "status": "unknown",
   "evidence": [],
   "note": "card states professional human translation; no separate post-translation QA/verification step is described at the pinned revision"
  },
  "license": {
   "status": "verified",
   "evidence": [
    "e2"
   ]
  },
  "derived_from": {
   "status": "verified",
   "evidence": [
    "e1"
   ]
  },
  "source_language": {
   "status": "verified",
   "evidence": [
    "e1"
   ]
  }
 },
 "evidence": [
  {
   "id": "e1",
   "type": "dataset_card",
   "url": "https://huggingface.co/datasets/openai/MMMLU/raw/325a01dc3e173cac1578df94120499aaca2e2504/README.md",
   "retrieved": "2026-08-24",
   "sha256": "6aa933306db7622f5cbbd9bffe5fcb65c3b4a39f6e75735fd33bc2181be189fc",
   "hub_revision": "325a01dc3e173cac1578df94120499aaca2e2504",
   "quote": "We translated the MMLU's test set into 14 languages using professional human translators."
  },
  {
   "id": "e2",
   "type": "hub_metadata",
   "url": "https://huggingface.co/api/datasets/openai/MMMLU",
   "retrieved": "2026-08-24",
   "hub_revision": "325a01dc3e173cac1578df94120499aaca2e2504",
   "quote": "license: mit"
  }
 ],
 "completeness": 0.8333,
 "provenance_state": "partial",
 "curated": {
  "date": "2026-08-24",
  "by": "benchprov v0 seed (A. H. Shihab)",
  "method": "assisted"
 }
}
