{
 "record_id": "mizinovmv-ru_cais_mmlu__ru",
 "schema_version": "0.1.0",
 "dataset": {
  "id": "mizinovmv/ru_cais_mmlu",
  "hub": "huggingface",
  "url": "https://huggingface.co/datasets/mizinovmv/ru_cais_mmlu",
  "revision": "4dc92508a76d9725f5ae3b0a773dd044695d5619"
 },
 "root_benchmark": "MMLU",
 "target_languages": [
  "ru"
 ],
 "source_language": "en",
 "derived_from": {
  "kind": "translation_of",
  "parent_id": "cais/mmlu",
  "parent_url": "https://huggingface.co/datasets/cais/mmlu"
 },
 "translation_type": "unknown",
 "engine_or_translator": "unknown",
 "human_verification": "unknown",
 "license": "apache-2.0",
 "claims": {
  "translation_type": {
   "status": "unknown",
   "evidence": [],
   "note": "the card is YAML-only; feature names (question_en/choices_en alongside Russian fields) show a translation-pair structure but no method"
  },
  "engine_or_translator": {
   "status": "unknown",
   "evidence": [],
   "note": "not stated"
  },
  "human_verification": {
   "status": "unknown",
   "evidence": [],
   "note": "no statement"
  },
  "license": {
   "status": "verified",
   "evidence": [
    "e1"
   ]
  },
  "derived_from": {
   "status": "verified",
   "evidence": [
    "e2"
   ]
  },
  "source_language": {
   "status": "verified",
   "evidence": [
    "e2"
   ]
  }
 },
 "evidence": [
  {
   "id": "e1",
   "type": "hub_metadata",
   "url": "https://huggingface.co/api/datasets/mizinovmv/ru_cais_mmlu",
   "retrieved": "2026-08-24",
   "hub_revision": "4dc92508a76d9725f5ae3b0a773dd044695d5619",
   "quote": "license: apache-2.0"
  },
  {
   "id": "e2",
   "type": "dataset_card",
   "url": "https://huggingface.co/datasets/mizinovmv/ru_cais_mmlu/raw/4dc92508a76d9725f5ae3b0a773dd044695d5619/README.md",
   "retrieved": "2026-08-24",
   "sha256": "95203808c1457f90185f1276ec12bb4363db3c53c187c5978742adda5efd155d",
   "hub_revision": "4dc92508a76d9725f5ae3b0a773dd044695d5619",
   "quote": "features: - name: question_en dtype: string - name: subject dtype: string - name: choices_en sequence: string",
   "note": "YAML features evidence a ru/en parallel structure; dataset id references cais/mmlu"
  }
 ],
 "completeness": 0.5,
 "provenance_state": "partial",
 "curated": {
  "date": "2026-08-24",
  "by": "benchprov v0 seed (A. H. Shihab)",
  "method": "assisted"
 }
}
