{
 "record_id": "rajpurkar-squad__en",
 "schema_version": "0.1.0",
 "dataset": {
  "id": "rajpurkar/squad",
  "hub": "huggingface",
  "url": "https://huggingface.co/datasets/rajpurkar/squad",
  "revision": "7b6d24c440a36b6815f21b70d25016731768db1f"
 },
 "root_benchmark": "SQuAD",
 "target_languages": [
  "en"
 ],
 "source_language": "not_applicable",
 "derived_from": {
  "kind": "none",
  "parent_id": null
 },
 "translation_type": "native_original",
 "engine_or_translator": "not_applicable",
 "human_verification": "not_applicable",
 "license": "cc-by-sa-4.0",
 "claims": {
  "translation_type": {
   "status": "verified",
   "evidence": [
    "e1"
   ]
  },
  "engine_or_translator": {
   "status": "not_applicable",
   "evidence": []
  },
  "human_verification": {
   "status": "not_applicable",
   "evidence": []
  },
  "license": {
   "status": "verified",
   "evidence": [
    "e2"
   ]
  },
  "derived_from": {
   "status": "verified",
   "evidence": [
    "e1"
   ]
  },
  "source_language": {
   "status": "not_applicable",
   "evidence": []
  }
 },
 "evidence": [
  {
   "id": "e1",
   "type": "dataset_card",
   "url": "https://huggingface.co/datasets/rajpurkar/squad/raw/7b6d24c440a36b6815f21b70d25016731768db1f/README.md",
   "retrieved": "2026-08-24",
   "sha256": "fb89c5d06573a2c7b7fb671ad60f5c1f3be2ccd7a63162f41b9e613abca0f0b8",
   "hub_revision": "7b6d24c440a36b6815f21b70d25016731768db1f",
   "quote": "consisting of questions posed by crowdworkers on a set of Wikipedia articles"
  },
  {
   "id": "e2",
   "type": "hub_metadata",
   "url": "https://huggingface.co/api/datasets/rajpurkar/squad",
   "retrieved": "2026-08-24",
   "hub_revision": "7b6d24c440a36b6815f21b70d25016731768db1f",
   "quote": "license: cc-by-sa-4.0"
  }
 ],
 "completeness": 1.0,
 "provenance_state": "complete",
 "curated": {
  "date": "2026-08-24",
  "by": "benchprov v0 seed (A. H. Shihab)",
  "method": "assisted"
 }
}
