{
 "record_id": "jon-tow-okapi_truthfulqa__multi",
 "schema_version": "0.1.0",
 "dataset": {
  "id": "jon-tow/okapi_truthfulqa",
  "hub": "huggingface",
  "url": "https://huggingface.co/datasets/jon-tow/okapi_truthfulqa",
  "revision": "cdd5db1a66fd04105622109d1c2a5cbc8cde7586"
 },
 "root_benchmark": "TruthfulQA",
 "target_languages": [
  "ar",
  "bn",
  "ca",
  "da",
  "de",
  "es",
  "eu",
  "fr",
  "gu",
  "hi",
  "hr",
  "hu",
  "hy",
  "id",
  "it",
  "kn",
  "ml",
  "mr",
  "ne",
  "nl",
  "pt",
  "ro",
  "ru",
  "sk",
  "sr",
  "sv",
  "ta",
  "te",
  "uk",
  "vi"
 ],
 "source_language": "en",
 "derived_from": {
  "kind": "translation_of",
  "parent_id": "truthfulqa/truthful_qa",
  "parent_url": "https://huggingface.co/datasets/truthfulqa/truthful_qa"
 },
 "translation_type": "unknown",
 "engine_or_translator": "unknown",
 "human_verification": "unknown",
 "license": "cc-by-nc-4.0",
 "claims": {
  "translation_type": {
   "status": "unknown",
   "evidence": [],
   "note": "the card states only 'Multilingual translation of TruthfulQA'; the Okapi/mlmm README documents ChatGPT translation for ARC/HellaSwag/MMLU but makes no equivalent statement for TruthfulQA"
  },
  "engine_or_translator": {
   "status": "unknown",
   "evidence": [],
   "note": "not stated for this set; cf. alexandrainst/m_truthfulqa, which attributes its University-of-Oregon TruthfulQA translations to GPT-3.5-turbo"
  },
  "human_verification": {
   "status": "unknown",
   "evidence": [],
   "note": "no statement found"
  },
  "license": {
   "status": "verified",
   "evidence": [
    "e1"
   ]
  },
  "derived_from": {
   "status": "verified",
   "evidence": [
    "e2"
   ]
  },
  "source_language": {
   "status": "verified",
   "evidence": [
    "e2"
   ]
  }
 },
 "evidence": [
  {
   "id": "e1",
   "type": "hub_metadata",
   "url": "https://huggingface.co/api/datasets/jon-tow/okapi_truthfulqa",
   "retrieved": "2026-08-24",
   "hub_revision": "cdd5db1a66fd04105622109d1c2a5cbc8cde7586",
   "quote": "license: cc-by-nc-4.0"
  },
  {
   "id": "e2",
   "type": "dataset_card",
   "url": "https://huggingface.co/datasets/jon-tow/okapi_truthfulqa/raw/cdd5db1a66fd04105622109d1c2a5cbc8cde7586/README.md",
   "retrieved": "2026-08-24",
   "sha256": "e45867d292c8a04935143aa574b0b3246ee49126489753099c5d0beb8f537819",
   "hub_revision": "cdd5db1a66fd04105622109d1c2a5cbc8cde7586",
   "quote": "Multilingual translation of TruthfulQA."
  }
 ],
 "completeness": 0.5,
 "provenance_state": "partial",
 "curated": {
  "date": "2026-08-24",
  "by": "benchprov v0 seed (A. H. Shihab)",
  "method": "assisted"
 }
}
